{
  "schemaVersion": "v1",
  "observationId": "costobs_jupiter_deployment_shadow_fixture_run_1",
  "modelId": "cost_model_jupiter_sol_usdc_spot",
  "deploymentId": "deployment_shadow_fixture",
  "runId": "deployment_shadow_fixture_run_1",
  "receiptId": "receipt_jupiter_deployment_shadow_fixture_run_1",
  "venueKey": "jupiter",
  "marketType": "spot",
  "pairSymbol": "SOL/USDC",
  "assetKeys": ["SOL", "USDC"],
  "mode": "paper",
  "observedAt": "2026-03-10T00:00:00.000Z",
  "evaluatedNotionalUsd": "25.00",
  "modeledTotalCostUsd": "0.11",
  "observedTotalCostUsd": "0.13",
  "costDriftUsd": "0.02",
  "costDriftBps": 80,
  "expectedEndToEndLatencyMs": 5750,
  "observedEndToEndLatencyMs": 6125,
  "latencyDriftMs": 375,
  "reconciliationStatus": "passed",
  "reconciliationDriftUsd": "0.02",
  "tags": ["cost-observation", "paper"],
  "notes": "Derived from runtime plan, receipt, and reconciliation artifacts."
}
